{"$schema":"sourcegraph-adoption-audit-key.schema.json","audit_version":1,"items":[{"audit_task_id":"6b5ba4dd8c2c0ccae813efcd410c3997b3477f00adcffc2de72092e8189945c7","canonical_repository_id":"rustdesk/rustdesk","event_id":"77af51935e1da29f3779f4655c98e1802efd5acba52ee4e32ea34d64d22992ea","evidence_channel":"recognized_agent_identity_commits","language":"Rust","primary_decision":"reject","primary_default_branch_supported":false,"primary_evidence_citations":["https://github.com/rustdesk/rustdesk/commit/e3cce2824d19cd74107f69f6f9e7428b93d189f6"],"primary_evidence_tier":"not_applicable","primary_rationale":"The commit identity names a human author and GitHub as committer; no recognized AI coding-agent identity or authorship disclosure is present.","primary_response_sha256":"77a37f58e3f8e4f8a67deb121fce44848ce02e30e06c2eeb963b6efbfe7eda00","primary_reviewer_id":"local-primary-b","stratum_id":"01e6452d2354dfb28500359d8e6f3cd58f716df7313ec7ccc343b42c078e3442","task_id":"20de87ae795d8914275b134927edd960f08e663cabe763343585ae1312dc41e9","task_sha256":"465eb0032af43eb092c6c354fb81a39119c9f0455ab8ab79ad06a895091d540a"},{"audit_task_id":"09a754bce63774b3d44a34c57c25b055d9eae2fc27e0628107f6bc177f1c5213","canonical_repository_id":"stirling-tools/stirling-pdf","event_id":"f2a41cc0e40d7ef26b2a2a123653280d7b8ed1b6a26541e55588206316ae6b11","evidence_channel":"agent_trailer_commits","language":"TOML","primary_decision":"accept_confirmed","primary_default_branch_supported":true,"primary_evidence_citations":["https://github.com/Stirling-Tools/Stirling-PDF/commit/27d2681a97088ae9147f42f87067e7c9239b3144"],"primary_evidence_tier":"confirmed","primary_rationale":"The merged change explicitly credits Copilot Autofix powered by AI as co-author, establishing agent participation in the code fix.","primary_response_sha256":"2697002e88c7b3cbc93f8b3a192da3786aada3ff08e3e8e624fff4de700b4f1d","primary_reviewer_id":"local-primary-b","stratum_id":"079346b84f5d3e8538e0f22f240ad89f5edcf0e3116452b85bfd4e43107c16ae","task_id":"8268b77098831e97706c34d8d159b9b72e11b6b34624e8d4b2c8f05647afe074","task_sha256":"80aba9b28f6b9a6ef04101e373acd612a533429a936190ae5a14ea07c252334d"},{"audit_task_id":"7a3c6192450e52b3764d5c454e0d4b376dea97d13bfed265347e321b9abaa409","canonical_repository_id":"django/django","event_id":"73e4edd0dad680734b803c3695b017ba0973fbc0945f4972ac416f96b738aea9","evidence_channel":"recognized_agent_identity_commits","language":"Python","primary_decision":"reject","primary_default_branch_supported":false,"primary_evidence_citations":["https://github.com/django/django/commit/2a14b8df39b573124ea42dec0ce96147c8e767d4"],"primary_evidence_tier":"not_applicable","primary_rationale":"The identity is the human contributor Claude Paroz, not an AI coding agent.","primary_response_sha256":"14608fb58d3480168f5b9b82d27ac8d43789c0667047f27621402765bdd1946d","primary_reviewer_id":"local-anchor-primary-a","stratum_id":"11ab65717129943a2e741231425ce71e6cc5b4266a38969662b27c36419509e5","task_id":"4a88d0ec90acb5ac42cd57456145707a99b28c390d0c574c28e1d1a7bbe3a39d","task_sha256":"8b503885c7f57b60cb487517e0819c6b218b0da6a61f1fd4133d2e963798a422"},{"audit_task_id":"03e8609cffa0bb10d49df11be2eee53f3e94f7c27f4d9ded447edec5879f207d","canonical_repository_id":"msitarzewski/agency-agents","event_id":"b4e16448d470b31ae904db699452ce877f197938b52731bd1d4437d0f1487afa","evidence_channel":"adoption_announcement_files","language":"Markdown","primary_decision":"insufficient","primary_default_branch_supported":false,"primary_evidence_citations":["https://github.com/msitarzewski/agency-agents/blob/8ef49232e02431f7ca4792b487e5a85a7939ff3a/specialized/agents-orchestrator.md#L9"],"primary_evidence_tier":"not_applicable","primary_rationale":"The repository adds reusable agent-persona and orchestration content, but the task evidence does not show that maintainers used those agents to author this repository at the recorded date.","primary_response_sha256":"bf74fabeb7d557332b48a03b53438b54d4adc68a21084806483150738e7afd9c","primary_reviewer_id":"local-primary-b","stratum_id":"16d6122bbab7b4f7cd1a919e6ba29d7d8e60a373e11e17c2a768e715c3d290d3","task_id":"9e2017fedc5743f0b9b2b65d18cb130f37e4447a56acdc367f6d008fa8c9fa14","task_sha256":"ac693a9663127c441d2b4de7697825c575988a24f73dc0a5d7d2ca535aa35916"},{"audit_task_id":"a30602ea1a47bb204f0ba339e6e1219db421775b6934b672aeef725614fb3271","canonical_repository_id":"openai/whisper","event_id":"3cf7b691328be0b126b2b76783deb109dc5ecb253926b2c9ad9de386496821fd","evidence_channel":"agent_trailer_commits","language":"SVG","primary_decision":"accept_confirmed","primary_default_branch_supported":true,"primary_evidence_citations":["https://github.com/openai/whisper/commit/04f449b8a437f1bbd3dba5c9f826aca972e7709a"],"primary_evidence_tier":"confirmed","primary_rationale":"The commit explicitly records Codex as co-author of changes that pin pre-commit hook revisions and add version comments, directly linking an AI coding agent to authored repository changes.","primary_response_sha256":"01792b4a05cb5e976325c56d899c624479443e93c80f182b7344c6286b91e2dc","primary_reviewer_id":"local-t7-primary-b","stratum_id":"207db7a6a5e6aecf6e3f0009e0b1f75c4947c20ee9c906858414fa166d7c629d","task_id":"f5451c6a3455cde30bd3a33c7c011d2abfbb252a132bde732501bafa28888790","task_sha256":"8d9bd74207a6b160c74eca94325fa534b7e5515fc707f2e07e552394a3c0ca97"},{"audit_task_id":"30f4b30d05836702310551a6ed60c826d1b30d3dd97d13b92d03be508797d66c","canonical_repository_id":"nationalsecurityagency/ghidra","event_id":"d54c1f4f526e8fb10068a532704702239d23bb70411b703e423595b1ec3c42fe","evidence_channel":"generated_code_disclosure_diffs","language":"Java","primary_decision":"reject","primary_default_branch_supported":false,"primary_evidence_citations":["https://github.com/NationalSecurityAgency/ghidra/commit/fc17ca970cf0780876478090b6567aa7f1dd5036"],"primary_evidence_tier":"not_applicable","primary_rationale":"The evidence only names Ghidra debugger-agent components; these are debugger connectors, not AI coding-agent provenance.","primary_response_sha256":"9373432ba6f6a19e64df12082c243bddba0c20e508c517f8d449b129ea761deb","primary_reviewer_id":"local-anchor-primary-b","stratum_id":"20c0380b38d7b628af549ca4093a3b7111862f4fdcabe82cb3661c9a8012ce50","task_id":"8188c0d31d29d838d58bd2b3300205f47ffc0e27ae9e3f0c2dfd49ae30f9fc3d","task_sha256":"0acea55de5b41776fa2e783e0717f8b562a346f7004c4f8da950633afd107324"},{"audit_task_id":"05e2199c948dc2947b49c5360dacbc5f716973abfb53c124640efe589e96cab9","canonical_repository_id":"nvm-sh/nvm","event_id":"b2b66a6078d982d22a9893266acf77707bc693bd66ab74ea2aa0e0b492ef94c4","evidence_channel":"adoption_announcement_files+recognized_agent_identity_commits","language":"Shell","primary_decision":"accept_confirmed","primary_default_branch_supported":true,"primary_evidence_citations":["https://github.com/nvm-sh/nvm/commit/9602f4f959a9f64515fc13af2904a87dc03de685"],"primary_evidence_tier":"confirmed","primary_rationale":"The commit identity names the Copilot SWE agent bot as the repository change author.","primary_response_sha256":"3e9fb95781e7897642514e32b36e0f7345759024584e036cc00517e76fdcc475","primary_reviewer_id":"local-anchor-primary-b","stratum_id":"24e6854ec76131042f1f5e288131a77438b8beac038334dde1da5229a79395b9","task_id":"5a44926ff1f6908cce96ca66ee312e7470e1756a108ae871d5964b8cafa0f7d6","task_sha256":"fecdcc0ef467c9f8205c5adda29815a54f9da5cc01c4af5cdb1827228517723b"},{"audit_task_id":"3a3483b015563776f4385adfad375dce09356690762458651329bee64f3a9a67","canonical_repository_id":"ventoy/ventoy","event_id":"de3ed7e10f6c8caa9a72a9ca11da8f848240beb7666a51cad008ad7533540bff","evidence_channel":"recognized_agent_identity_commits","language":"C","primary_decision":"insufficient","primary_default_branch_supported":false,"primary_evidence_citations":["https://github.com/ventoy/Ventoy/commit/0fd49126bd59b9a5e6c305d7ca915ab0fc1560e5"],"primary_evidence_tier":"not_applicable","primary_rationale":"The author identity Moses Cursor with a personal email may reference Cursor, but it does not establish that a coding agent authored the commit or provide a defensible repository-adoption event.","primary_response_sha256":"309dadc3494af8f0e575330c0d6ae6abb16fd54fc2fb759c9c0ac9a1024078bd","primary_reviewer_id":"local-t5-primary-b","stratum_id":"25c0c8d265e25200ed551aeb1d34ccb55ec18cf5233afde4bcf58961832361b4","task_id":"08fc1d1390b3c690ecad6f9d54e4e8ae0468ac1b1720a5edc4cecf84b6f944a3","task_sha256":"f0a6ee9d2cc7a00f0d06b35bcca1a376b01fd6983528409b0e11e20354ba7ac7"},{"audit_task_id":"e10f9f1e45789fe2b521ac8590bf1159be4621086457c4f329d8e5f8a16f2d73","canonical_repository_id":"angular/angular","event_id":"43b3cd1869c4bfa1094218e5374a5c9a0127235243b3a0253b7fa33add6917d2","evidence_channel":"generated_code_disclosure_diffs","language":"TypeScript","primary_decision":"accept_observed","primary_default_branch_supported":true,"primary_evidence_citations":["https://github.com/angular/angular/commit/2e3492464769b468b7471ee0b7d17a56f253344b"],"primary_evidence_tier":"observed","primary_rationale":"The repository adds an AI-agent PR-review skill governing agent-authored comments and AGENT prefixes. This is configuration for AI review-agent use, but not an agent-authored code change.","primary_response_sha256":"97f638f17ffe3327d739bf408ac839eab3d16fcb62d7ae1c36a5530f912e25e9","primary_reviewer_id":"local-anchor-primary-a","stratum_id":"2fddb659865c49be64cb7e158e04b5d347dc6f883cb1bd667b84a27299a67b5f","task_id":"c4c423d4ca9ba115e49f1815222ba2d311eb3f89e59a95df14ceccf721365fd7","task_sha256":"636a98c8d181a2dd2d916d73a360d1f849c36474625a8338368ce7953e503cf6"},{"audit_task_id":"099c5e950b389af7bba1249dda85431d95abe3fb437ed3f47dd4e6070d60cb87","canonical_repository_id":"redis/redis","event_id":"aeacefacef45d5bf6679c96d249f2b13d0345113d57237550597f91598b15173","evidence_channel":"agent_trailer_commits","language":"C","primary_decision":"accept_confirmed","primary_default_branch_supported":true,"primary_evidenc